{
  "schemaVersion": 1,
  "moduleId": "anesthesia",
  "scenarioCount": 36,
  "scenarios": [
    {
      "id": "routine-induction",
      "path": "/anesthesia/scenario/routine-induction",
      "title": "Routine induction of general anaesthesia",
      "contentVersion": "0.1.0",
      "estimatedMinutes": 12,
      "difficulty": "introductory",
      "maturity": "draft",
      "environment": "operating-room",
      "practiceRegions": [
        "US",
        "GB"
      ],
      "fidelityClass": "closed_loop_physiology",
      "objectives": [
        "Preoxygenate before inducing, and explain what it buys you.",
        "Wait for the effect site rather than the syringe: recognise that the last dose has not yet fully acted.",
        "Recognise vasodilatory hypotension after induction and treat the mechanism.",
        "Establish ventilation before saturation falls.",
        "Give enough opioid that incision does not provoke a haemodynamic response."
      ],
      "searchText": "routine-induction routine induction of general anaesthesia symptomatic cholelithiasis laparoscopic cholecystectomy preoxygenate before inducing, and explain what it buys you. end-tidal oxygen fraction reached 0.9 and was held there for at least three minutes before the airway was secured. end-tidal, not inspired: the inspired fraction says what the machine delivered, not whether the lungs filled. wait for the effect site rather than the syringe: recognise that the last dose has not yet fully acted. no propofol bolus was given while effect-site concentration was still rising toward its peak from the previous one. recognise vasodilatory hypotension after induction and treat the mechanism. mean arterial pressure spent less than two minutes below 65 mmhg, and never fell below 55 mmhg. establish ventilation before saturation falls. oxygen saturation never fell below 92%. give enough opioid that incision does not provoke a haemodynamic response. heart rate and mean arterial pressure rose by less than 20% in the minute after incision."
    },
    {
      "id": "rapid-desaturation",
      "path": "/anesthesia/scenario/rapid-desaturation",
      "title": "Rapid desaturation in the obese patient",
      "contentVersion": "0.1.0",
      "estimatedMinutes": 10,
      "difficulty": "intermediate",
      "maturity": "draft",
      "environment": "operating-room",
      "practiceRegions": [
        "US",
        "GB"
      ],
      "fidelityClass": "closed_loop_physiology",
      "objectives": [
        "Preoxygenate properly, because this patient gives you almost no margin.",
        "Secure the airway, or go back to the mask, before the saturation falls.",
        "Limit laryngoscopy attempts, and change something between them.",
        "Wait for the effect site rather than the syringe."
      ],
      "searchText": "rapid-desaturation rapid desaturation in the obese patient symptomatic gallstones laparoscopic cholecystectomy preoxygenate properly, because this patient gives you almost no margin. end-tidal oxygen fraction reached 0.9 and was held there for at least three minutes before the airway was secured. secure the airway, or go back to the mask, before the saturation falls. oxygen saturation never fell below 92%. limit laryngoscopy attempts, and change something between them. no more than two attempts at direct laryngoscopy before switching technique or returning to mask ventilation. wait for the effect site rather than the syringe. no propofol bolus was given while effect-site concentration was still rising toward its peak from the previous one."
    },
    {
      "id": "hypotension-after-induction",
      "path": "/anesthesia/scenario/hypotension-after-induction",
      "title": "Hypotension after induction",
      "contentVersion": "0.1.0",
      "estimatedMinutes": 12,
      "difficulty": "intermediate",
      "maturity": "draft",
      "environment": "operating-room",
      "practiceRegions": [
        "US",
        "GB"
      ],
      "fidelityClass": "closed_loop_physiology",
      "objectives": [
        "Dose the induction for the patient in front of you, not for the textbook adult.",
        "Keep the mean arterial pressure up.",
        "Work out whether the pressure fell because the vessels dilated or because the tank is empty, and treat that.",
        "Establish ventilation before saturation falls."
      ],
      "searchText": "hypotension-after-induction hypotension after induction small bowel obstruction, vomiting for two days laparotomy dose the induction for the patient in front of you, not for the textbook adult. the first propofol bolus was no more than 1.5 mg/kg, and it was given slowly enough that the effect site was allowed to catch up before more was given. keep the mean arterial pressure up. mean arterial pressure spent less than two minutes below 65 mmhg, and never fell below 55 mmhg. work out whether the pressure fell because the vessels dilated or because the tank is empty, and treat that. fluid was given, rather than vasopressor alone, in a patient whose pulse pressure was narrow and swinging with the ventilator. establish ventilation before saturation falls. oxygen saturation never fell below 92%."
    },
    {
      "id": "bronchospasm",
      "path": "/anesthesia/scenario/bronchospasm",
      "title": "Bronchospasm after intubation",
      "contentVersion": "0.1.0",
      "estimatedMinutes": 12,
      "difficulty": "intermediate",
      "maturity": "draft",
      "environment": "operating-room",
      "practiceRegions": [
        "US",
        "GB"
      ],
      "fidelityClass": "closed_loop_physiology",
      "objectives": [
        "Read the capnogram as a shape, not as a number.",
        "Deepen the anaesthetic before treating the wheeze as a separate problem.",
        "Escalate the evolving lower-airway obstruction and establish high inspired oxygen.",
        "Give the modeled first-line inhaled bronchodilator after recognizing obstruction.",
        "Keep the saturation up while you work out what is happening.",
        "Keep the mean arterial pressure up."
      ],
      "searchText": "bronchospasm bronchospasm after intubation recurrent tonsillitis tonsillectomy read the capnogram as a shape, not as a number. the obstruction was recognised while the end-tidal carbon dioxide value was still inside its alarm limits — that is, from the waveform rather than from the alarm. deepen the anaesthetic before treating the wheeze as a separate problem. predicted depth was brought back into the surgical range, or a bolus was given, in the two minutes after the obstruction began. escalate the evolving lower-airway obstruction and establish high inspired oxygen. help was requested and inspired oxygen was set to 100% within 60 seconds of onset. give the modeled first-line inhaled bronchodilator after recognizing obstruction. a confirmed 5 mg nebulized salbutamol action was accepted within two minutes of onset. keep the saturation up while you work out what is happening. oxygen saturation never fell below 92%. keep the mean arterial pressure up. mean arterial pressure spent less than two minutes below 65 mmhg, and never fell below 55 mmhg."
    },
    {
      "id": "unexpected-intraoperative-hemorrhage",
      "path": "/anesthesia/scenario/unexpected-intraoperative-hemorrhage",
      "title": "Unexpected intraoperative hemorrhage",
      "contentVersion": "0.1.0",
      "estimatedMinutes": 9,
      "difficulty": "advanced",
      "maturity": "draft",
      "environment": "operating-room",
      "practiceRegions": [
        "US",
        "GB"
      ],
      "fidelityClass": "closed_loop_physiology",
      "objectives": [
        "Recognize compensated hemorrhage before the pressure is the only clue.",
        "Temporize volume loss while definitive hemorrhage control is obtained.",
        "Reduce the induction dose for a patient who is already volume depleted.",
        "Protect perfusion while the surgeon controls the bleeding."
      ],
      "searchText": "unexpected-intraoperative-hemorrhage unexpected intraoperative hemorrhage hemoperitoneum from a ruptured ectopic pregnancy emergency laparotomy recognize compensated hemorrhage before the pressure is the only clue. balanced crystalloid was started within 60 seconds of the rapid blood-loss event. temporize volume loss while definitive hemorrhage control is obtained. at least 1,000 ml of balanced crystalloid was given before surgical control. reduce the induction dose for a patient who is already volume depleted. the first propofol bolus was no more than 0.75 mg/kg. protect perfusion while the surgeon controls the bleeding. mean arterial pressure spent less than two minutes below 65 mmhg and never fell below 55 mmhg."
    },
    {
      "id": "rapid-sequence-induction",
      "path": "/anesthesia/scenario/rapid-sequence-induction",
      "title": "Rapid-sequence induction",
      "contentVersion": "0.2.0",
      "estimatedMinutes": 10,
      "difficulty": "intermediate",
      "maturity": "draft",
      "environment": "operating-room",
      "practiceRegions": [
        "US",
        "GB"
      ],
      "fidelityClass": "closed_loop_physiology",
      "objectives": [
        "Fill the patient's oxygen reserve before giving the first induction drug.",
        "Give the hypnotic before paralysis, then allow the modeled block to develop.",
        "Secure ventilation before the oxygen reserve is exhausted.",
        "Resume delivered ventilation and sustained gas exchange after airway instrumentation.",
        "Match reversal to the observed block depth and confirm quantitative recovery."
      ],